{"run":23,"commit":"bcff2ec","metric":2321705223000,"metrics":{"package_bytes":232170567,"zip_bytes":99446868,"locale_bytes":569838,"asar_bytes":2444719,"renderer_js_bytes":1407327,"main_js_bytes":850444,"stockfish_bytes":0,"marketing_bytes":1363209,"lh_perf":0,"lh_a11y":95,"lh_bp":0,"lh_seo":82,"lh_pages":6,"knip_issues":0,"unreferenced_images":0},"status":"keep","description":"Ship piece-theme drawings as gzip inflated before first paint, not as a stylesheet. The sets are unchanged.","timestamp":1791626061279,"segment":0,"confidence":689.1377925200356,"asi":{"hypothesis":"Gzipping the piece-theme CSS shrinks the unpacked package because the stylesheet is mostly SVG text","learned":"Unpacked app and asar both fell 134910 bytes. Renderer JS grew 98427 because the gzip string moved there. Arm64 zip rose 23467 bytes: the CSS was already compressing well in the zip. Not catastrophic, but do not gzip more text that the zip already compresses. Pieces inject before first paint; CSP allows unsafe-inline.","package_delta":134910,"zip_delta":-23467,"asar_delta":134910}}
{"run":24,"commit":"56799a4","metric":2309000223000,"metrics":{"package_bytes":230900012,"zip_bytes":98895362,"locale_bytes":569838,"asar_bytes":2444719,"renderer_js_bytes":1407327,"main_js_bytes":850444,"stockfish_bytes":0,"marketing_bytes":1363209,"lh_perf":0,"lh_a11y":95,"lh_bp":0,"lh_seo":82,"lh_pages":6,"knip_issues":0,"unreferenced_images":0},"status":"keep","description":"Drop Chromium's unused crashpad handler from the packaged app. The app does not start crashReporter, and it still launches.","timestamp":1791626667635,"segment":0,"confidence":607.3119891146115,"asi":{"hypothesis":"chrome_crashpad_handler is unused because the app never calls crashReporter, so removing it shrinks the package and the zip","learned":"Unpacked app fell 1270555 bytes and the arm64 zip fell 551506. All 6 packaged-app Lighthouse pages still loaded. Do not remove libvk_swiftshader or libffmpeg; those can break rendering or sound on machines this Mac does not represent.","package_delta":1270555,"zip_delta":551506}}
{"run":25,"commit":"8a743e9","metric":2308968223000,"metrics":{"package_bytes":230896865,"zip_bytes":98894221,"locale_bytes":569838,"asar_bytes":2444719,"renderer_js_bytes":1407327,"main_js_bytes":850444,"stockfish_bytes":0,"marketing_bytes":1363209,"lh_perf":0,"lh_a11y":95,"lh_bp":0,"lh_seo":82,"lh_pages":6,"knip_issues":0,"unreferenced_images":0},"status":"keep","description":"Drop pre-10.8 ARGB icon chunks from the icns. Electron 42 only needs the PNG sizes, and the dock icon is unchanged.","timestamp":1791627020278,"segment":0,"confidence":421.3445560148128,"asi":{"hypothesis":"ic04 and ic05 are legacy ARGB icon types modern macOS does not read, so removing them shrinks the icns without changing the dock icon","learned":"Unpacked app fell exactly 3147 bytes and the arm64 zip fell 1141. PNG icon types ic07-ic14 remain. Do not drop those; macOS uses them.","package_delta":3147,"zip_delta":1141}}
{"run":26,"commit":"3fb6a4c","metric":2308794223000,"metrics":{"package_bytes":230879433,"zip_bytes":98894010,"locale_bytes":569838,"asar_bytes":2427287,"renderer_js_bytes":1336309,"main_js_bytes":850444,"stockfish_bytes":0,"marketing_bytes":1363209,"lh_perf":0,"lh_a11y":95,"lh_bp":0,"lh_seo":82,"lh_pages":6,"knip_issues":0,"unreferenced_images":0},"status":"keep","description":"Ship piece drawings as a gzip file instead of a base64 string. Same sets, inflated before first paint.","timestamp":1791627494143,"segment":0,"confidence":293.40376203947767,"asi":{"hypothesis":"Base64 inflates the already-gzipped piece drawings by a third, so a raw gzip asset is smaller in the package and the zip","learned":"Unpacked app fell 17432 bytes and the arm64 zip fell 211. The packaged file:// page fetched the asset, so the sets still inflate before paint. Do not wrap binary assets in base64 again.","package_delta":17432,"zip_delta":211}}
{"run":27,"commit":"3fb6a4c","metric":0,"metrics":{"package_bytes":230811460,"zip_bytes":98841991,"locale_bytes":569838,"asar_bytes":2359314,"renderer_js_bytes":1336309,"main_js_bytes":782475,"stockfish_bytes":0,"marketing_bytes":1363209,"lh_perf":0,"lh_a11y":0,"lh_bp":0,"lh_seo":0,"lh_pages":0,"knip_issues":0,"unreferenced_images":0},"status":"crash","description":"Reading the opening book as a sibling gzip file dropped the base64 string, but the build never copied the file, so the packaged app did not start.","timestamp":1791627646109,"segment":0,"confidence":293.40376203947767,"asi":{"hypothesis":"The opening book base64 string can be a raw gzip file read with import.meta.url, same as the piece drawings","rollback_reason":"Vite rewrote the URL to ./opening-book.txt.gz next to out/main/index.js but did not emit the file. The main process crashed before the debugging port opened.","next_action_hint":"Copy opening-book.txt.gz into out/main during the main build so the rewritten URL resolves, then keep only if the app starts and package_bytes stays below 230879433.","learned":"The missing file would have saved about 68KB unpacked and 52KB of zip. Adding the 51KB gzip back should still beat the current best on both, if the app launches."}}
{"run":28,"commit":"e9b36c3","metric":2308627223000,"metrics":{"package_bytes":230862751,"zip_bytes":98893637,"locale_bytes":569838,"asar_bytes":2410605,"renderer_js_bytes":1336318,"main_js_bytes":782475,"stockfish_bytes":0,"marketing_bytes":1363209,"lh_perf":0,"lh_a11y":95,"lh_bp":0,"lh_seo":82,"lh_pages":6,"knip_issues":0,"unreferenced_images":0},"status":"keep","description":"Ship the opening book as a gzip file beside the main bundle. Same openings, no base64 wrapper.","timestamp":1791627791600,"segment":0,"confidence":228.78081686651473,"asi":{"hypothesis":"Copying the opening-book gzip into out/main lets the rewritten import.meta.url resolve, so the base64 string can leave the bundle","revisits_run":27,"learned":"Unpacked app fell 16682 bytes and the arm64 zip fell 373. The packaged app started and all 6 pages audited. Vite still does not emit the asset; the closeBundle copy is required.","package_delta":16682,"zip_delta":373}}
