{"type":"config","name":"Shrink Chaturanga package, drop dead code, raise Lighthouse","metricName":"package_bytes","metricUnit":"b","bestDirection":"lower"}
{"type":"config","name":"Shrink Chaturanga installers, drop dead code and images, raise Lighthouse","metricName":"score","metricUnit":"\"\"","bestDirection":"lower"}
{"run":1,"commit":"883bb85","metric":0,"metrics":{},"status":"crash","description":"Baseline measure died in Lighthouse before a score existed. --preset=mobile is not a lighthouse preset (choices: perf, experimental, desktop). Partial package scan also triple-counted Electron framework symlinks (package_bytes 840MB vs zip 112MB).","timestamp":1791589471827,"segment":0,"confidence":null,"asi":{"hypothesis":"The measure script can package the mac arm64 app and report a baseline score","rollback_reason":"lighthouse CLI rejected --preset=mobile; no score was emitted","next_action_hint":"Drop --preset for the mobile run (mobile is the default). Measure package bytes with lstat so framework symlinks are not followed. Do not treat the 840MB figure as the baseline.","zip_bytes":112446644,"stockfish_bytes":0,"locale_bytes_inflated":147687519}}
{"run":2,"commit":"883bb85","metric":0,"metrics":{},"status":"crash","description":"Harness fix measured a real 285MB app and 112MB zip with no Stockfish, but Lighthouse rejected the Electron file:// URL (INVALID_URL) after marketing scored 99–100.","timestamp":1791589966814,"segment":0,"confidence":null,"asi":{"hypothesis":"Symlink-safe package bytes plus default mobile Lighthouse preset produce a baseline score","rollback_reason":"Lighthouse INVALID_URL on the Electron renderer file:// URL; score.mjs never ran","next_action_hint":"Audit the production renderer over http (same out/renderer files). Do not use the 840MB figure. Marketing mins so far: perf 99, a11y 100, bp 96, seo 100. Biggest size lever remains electronLanguages en (~49MB locales).","package_bytes":285364818,"zip_bytes":112446084,"locale_bytes":49229173,"stockfish_bytes":0,"marketing_lh_perf_min":99,"marketing_lh_bp_min":96}}
{"run":3,"commit":"883bb85","metric":0,"metrics":{},"status":"crash","description":"All seven page audits and the package scan finished, but score.mjs dropped lh_a11y because its metric regex rejected digits.","timestamp":1791590157515,"segment":0,"confidence":null,"asi":{"hypothesis":"HTTP audits of the production renderer complete a baseline score","rollback_reason":"METRIC name regex [a-z_]+ does not match lh_a11y","next_action_hint":"Regex is now [a-z0-9_]+. Exclude scripts/piece-svg-sources from unreferenced images; the generator walks that directory. Then rerun for the baseline. Observed: package_bytes 285364805, zip 112446644, locales 49229173, stockfish 0, lh min perf 71 a11y 100 bp 96 seo 90, knip 122.","revisits_run":2,"package_bytes":285364805,"zip_bytes":112446644,"lh_perf":71,"lh_seo":90,"knip_issues":122}}
{"run":4,"commit":"883bb85","metric":2867280043133,"metrics":{"package_bytes":285364805,"zip_bytes":112446644,"locale_bytes":49229173,"asar_bytes":6137314,"renderer_js_bytes":3750846,"main_js_bytes":1911012,"stockfish_bytes":0,"marketing_bytes":1363209,"lh_perf":71,"lh_a11y":100,"lh_bp":96,"lh_seo":90,"lh_pages":7,"knip_issues":122,"unreferenced_images":11},"status":"checks_failed","description":"Score script finally ran, but the audit was a browser static server and lint failed on unused harness imports. Desktop pages must be measured in the packaged app, not a browser.","timestamp":1791590307698,"segment":0,"confidence":null,"asi":{"hypothesis":"Fixed metric parsing yields a keepable baseline","rollback_reason":"checks.sh lint failed on unused .auto imports, and the desktop scores came from a browser static server. The user requires Lighthouse in the desktop app build only.","next_action_hint":"Launch the packaged Electron app, attach Lighthouse to its debugging port, and navigate hash routes inside that app. Drop the browser static-server audit. Fix unused imports so oxlint passes.","revisits_run":3,"invalid_because":"browser_not_desktop_build"}}
{"run":5,"commit":"883bb85","metric":0,"metrics":{"package_bytes":285364805,"zip_bytes":112446644,"locale_bytes":49229173,"asar_bytes":6137314,"renderer_js_bytes":3750846,"main_js_bytes":1911012,"stockfish_bytes":0,"marketing_bytes":1363209,"lh_perf":0,"lh_a11y":100,"lh_bp":100,"lh_seo":60,"lh_pages":1,"knip_issues":122,"unreferenced_images":11},"status":"crash","description":"Packaged app launched and the onboarding snapshot ran, but route reloads reported NO_FCP because the window was not painting.","timestamp":1791590629139,"segment":0,"confidence":null,"asi":{"hypothesis":"Lighthouse attached to the packaged Electron app can score its routes","rollback_reason":"NO_FCP on in-app navigation; window was occluded and backgroundThrottling stays on unless CHATURANGA_E2E_BACKGROUND=1","next_action_hint":"Drive the packaged app the way e2e does: background hook, occluded-window flags, CDP focus emulation, page.reload inside the electron page. Do not fall back to a browser.","revisits_run":4}}
{"run":6,"commit":"883bb85","metric":0,"metrics":{"package_bytes":285364805,"zip_bytes":112446644,"locale_bytes":49229173,"asar_bytes":6137314,"renderer_js_bytes":3750846,"main_js_bytes":1911012,"stockfish_bytes":0,"marketing_bytes":1363209,"lh_perf":0,"lh_a11y":96,"lh_bp":0,"lh_seo":82,"lh_pages":1,"knip_issues":122,"unreferenced_images":11},"status":"crash","description":"Packaged-app onboarding audit returned, then Skip setup click used a handle from before the reload and the page context was gone.","timestamp":1791590757690,"segment":0,"confidence":null,"asi":{"hypothesis":"Background paint hook lets packaged-app Lighthouse finish every route","rollback_reason":"Skip setup element handle was taken before the onboarding reload, so click failed with DOM.describeNode context gone","next_action_hint":"Re-query Skip setup after the onboarding audit. Stay on the packaged binary. file:// best-practices will include is-on-https; do not switch the audit to a browser to hide that.","revisits_run":5}}
{"run":7,"commit":"e8c3b52","metric":2853648223133,"metrics":{"package_bytes":285364805,"zip_bytes":112446644,"locale_bytes":49229173,"asar_bytes":6137314,"renderer_js_bytes":3750846,"main_js_bytes":1911012,"stockfish_bytes":0,"marketing_bytes":1363209,"lh_perf":0,"lh_a11y":95,"lh_bp":0,"lh_seo":82,"lh_pages":6,"knip_issues":122,"unreferenced_images":11},"status":"keep","description":"Baseline of the packaged macOS app. Stockfish is not bundled. Lighthouse is the Electron binary; file:// zeros performance and best-practices (no paint metric, is-on-https).","timestamp":1791590945433,"segment":0,"confidence":null,"asi":{"hypothesis":"A packaged-app Lighthouse run can establish a baseline score","learned":"49MB of Electron lproj ships. file:// audits fail is-on-https, bf-cache, robots-txt, meta-description, color-contrast. Do not move the audit to a browser to hide protocol failures. Next size cut is electronLanguages en plus en-US so Windows pak names still match.","stockfish_bytes":0,"locale_bytes":49229173}}
{"run":8,"commit":"e8c3b52","metric":0,"metrics":{"package_bytes":236625143,"zip_bytes":100750084,"locale_bytes":569838,"asar_bytes":6137314,"renderer_js_bytes":3750846,"main_js_bytes":1911012,"stockfish_bytes":0,"marketing_bytes":1363209,"lh_perf":0,"lh_a11y":95,"lh_bp":0,"lh_seo":82,"lh_pages":6,"knip_issues":122,"unreferenced_images":11},"status":"crash","description":"English-only Electron locales cut the app from 285MB to 237MB and the zip from 112MB to 101MB. Lighthouse matched the baseline, then profile cleanup threw ENOTEMPTY and hid the score.","timestamp":1791591050273,"segment":0,"confidence":null,"asi":{"hypothesis":"electronLanguages en+en-US drops non-English lproj without changing Lighthouse or checks","rollback_reason":"rmSync of the throwaway profile threw ENOTEMPTY after a successful audit, so score.mjs never ran","next_action_hint":"Cleanup must not fail the measure. Re-apply electronLanguages [en, en-US] and keep if package_bytes stays near 236625143 and lh_pages stays 6.","revisits_run":7,"package_bytes":236625143,"zip_bytes":100750084,"locale_bytes":569838}}
{"run":9,"commit":"0bcdf7a","metric":2366251223133,"metrics":{"package_bytes":236625143,"zip_bytes":100750084,"locale_bytes":569838,"asar_bytes":6137314,"renderer_js_bytes":3750846,"main_js_bytes":1911012,"stockfish_bytes":0,"marketing_bytes":1363209,"lh_perf":0,"lh_a11y":95,"lh_bp":0,"lh_seo":82,"lh_pages":6,"knip_issues":122,"unreferenced_images":11},"status":"keep","description":"Ship only English Electron locales (en and en-US). Unpacked app 285MB to 237MB, zip 112MB to 101MB. Lighthouse unchanged.","timestamp":1791591167920,"segment":0,"confidence":173.5829275278723,"asi":{"hypothesis":"electronLanguages en+en-US drops non-English lproj without hurting the packaged app","learned":"Mac keeps en.lproj (570KB). Zip fell 11.7MB, unpacked 48.7MB. en-US is listed so Windows locale paks are not deleted. Do not drop en-US.","revisits_run":8,"locale_bytes":569838,"zip_bytes":100750084}}
{"run":10,"commit":"34999b8","metric":2362016223133,"metrics":{"package_bytes":236201647,"zip_bytes":100369081,"locale_bytes":569838,"asar_bytes":6137310,"renderer_js_bytes":3750846,"main_js_bytes":1911008,"stockfish_bytes":0,"marketing_bytes":1363209,"lh_perf":0,"lh_a11y":95,"lh_bp":0,"lh_seo":82,"lh_pages":6,"knip_issues":122,"unreferenced_images":11},"status":"keep","description":"Stop shipping a second copy of the macOS icon. The bundle already has icon.icns; the window falls back to that, then the png.","timestamp":1791591332118,"segment":0,"confidence":9.608879093033,"asi":{"hypothesis":"extraResources app-icon.icns duplicates the bundle icon.icns","learned":"Removed 423496 unpacked bytes and 381KB from the zip. Dock icon is still electron-builder's icon.icns. Do not delete app-icon.png; Windows and Linux use it.","package_delta":423496}}
{"run":11,"commit":"34999b8","metric":2362018214122,"metrics":{"package_bytes":236201843,"zip_bytes":100369153,"locale_bytes":569838,"asar_bytes":6137506,"renderer_js_bytes":3750846,"main_js_bytes":1911008,"stockfish_bytes":0,"marketing_bytes":1363209,"lh_perf":0,"lh_a11y":95,"lh_bp":0,"lh_seo":91,"lh_pages":6,"knip_issues":122,"unreferenced_images":0},"status":"discard","description":"Deleted unused icon sources and added a meta description. SEO rose 82 to 91, but the description added 196 bytes and the score got worse.","timestamp":1791591460375,"segment":0,"confidence":557.7370066429752,"asi":{"hypothesis":"Unused icon sources and a renderer meta description improve the score","rollback_reason":"package_bytes rose 196 bytes, crossing two 100-byte score units, which outweighed the SEO gain and the dead-image drop","next_action_hint":"Delete only the unreferenced iconset and white-on-black png so package_bytes stays flat. Revisit the meta description only alongside a larger size cut.","revisits_run":10,"seo_gain":9,"package_delta":196}}
{"run":12,"commit":"0776785","metric":2362016223122,"metrics":{"package_bytes":236201647,"zip_bytes":100369081,"locale_bytes":569838,"asar_bytes":6137310,"renderer_js_bytes":3750846,"main_js_bytes":1911008,"stockfish_bytes":0,"marketing_bytes":1363209,"lh_perf":0,"lh_a11y":95,"lh_bp":0,"lh_seo":82,"lh_pages":6,"knip_issues":122,"unreferenced_images":0},"status":"keep","description":"Remove the unreferenced iconset and white-on-black icon. They were not in the package. Dead-image count is now zero.","timestamp":1791591571020,"segment":0,"confidence":1114.9498420563084,"asi":{"hypothesis":"Deleting unreferenced icon sources drops dead_units without growing the package","learned":"package_bytes unchanged, unreferenced_images 11 to 0. Meta description still not worth 196 bytes under the 100-byte score step. icon.icns source iconset is gone; the built icns remains.","revisits_run":11}}
{"run":13,"commit":"0776785","metric":2362016223122,"metrics":{"package_bytes":236201647,"zip_bytes":100368967,"locale_bytes":569838,"asar_bytes":6137310,"renderer_js_bytes":3750846,"main_js_bytes":1911008,"stockfish_bytes":0,"marketing_bytes":1363209,"lh_perf":0,"lh_a11y":95,"lh_bp":0,"lh_seo":82,"lh_pages":6,"knip_issues":122,"unreferenced_images":0},"status":"discard","description":"Brightened caption text to pass WCAG on dark surfaces. Packaged Lighthouse contrast score did not move.","timestamp":1791591790162,"segment":0,"confidence":1186346.671583124,"asi":{"hypothesis":"fg-subtle #727982 is the color-contrast failure on every packaged page","rollback_reason":"a11y stayed 95 and color-contrast still failed after the token change; score unchanged","next_action_hint":"Contrast failure is not the base fg-subtle token, or it is flaky under glass. Do not keep guessing colors. Next: knip ignoreExportsUsedInFile so in-file exports are not counted as dead, then delete symbols that are unused even in their file.","package_bytes":236201647}}
{"run":14,"commit":"0776785","metric":2362016223001,"metrics":{"package_bytes":236201647,"zip_bytes":100369081,"locale_bytes":569838,"asar_bytes":6137310,"renderer_js_bytes":3750846,"main_js_bytes":1911008,"stockfish_bytes":0,"marketing_bytes":1363209,"lh_perf":0,"lh_a11y":95,"lh_bp":0,"lh_seo":82,"lh_pages":6,"knip_issues":1,"unreferenced_images":0},"status":"checks_failed","description":"Dead exports dropped knip from 122 to 1, but lint failed: unused glass snapshot state and a let that should be const.","timestamp":1791591972680,"segment":0,"confidence":2372536.0479586488,"asi":{"hypothesis":"Removing exports nothing imports, and not counting in-file exports as dead, clears knip","rollback_reason":"oxlint: window-glass current is unused after the hook went away; importWorkers must be const","next_action_hint":"Re-apply the deletions, drop the unused current variable, and change importWorkers to const. Then find the last knip issue.","revisits_run":12,"knip_issues":1}}
{"run":15,"commit":"95feb6f","metric":2362016223000,"metrics":{"package_bytes":236201647,"zip_bytes":100369081,"locale_bytes":569838,"asar_bytes":6137310,"renderer_js_bytes":3750846,"main_js_bytes":1911008,"stockfish_bytes":0,"marketing_bytes":1363209,"lh_perf":0,"lh_a11y":95,"lh_bp":0,"lh_seo":82,"lh_pages":6,"knip_issues":0,"unreferenced_images":0},"status":"keep","description":"Remove exports nothing imports. Knip is clean once in-file exports and false-positive deps are not counted as dead.","timestamp":1791592167378,"segment":0,"confidence":17759520473.68421,"asi":{"hypothesis":"Symbols knip says nothing imports are dead and can be deleted without growing the package","learned":"knip_issues 122 to 0. package_bytes unchanged. Remaining Lighthouse failures on file:// are protocol limits plus color-contrast and label-content-name-mismatch that did not move when fg-subtle was brightened. Further Electron framework cuts (swiftshader, icu) would risk the board.","revisits_run":14,"knip_issues":0}}
{"run":16,"commit":"8df8093","metric":2360771223000,"metrics":{"package_bytes":236077121,"zip_bytes":100250020,"locale_bytes":569838,"asar_bytes":6137043,"renderer_js_bytes":3750752,"main_js_bytes":1910835,"stockfish_bytes":0,"marketing_bytes":1363209,"lh_perf":0,"lh_a11y":95,"lh_bp":0,"lh_seo":82,"lh_pages":6,"knip_issues":0,"unreferenced_images":0},"status":"keep","description":"Stop copying app-icon.png into the macOS package. The bundle icon.icns is already there; Windows and Linux still get the png.","timestamp":1791594614396,"segment":0,"confidence":2371297.412212813,"asi":{"hypothesis":"macOS Resources/app-icon.png is unused once icon.icns is present, so the png extraResource can be win/linux only","learned":"Unpacked app fell 124526 bytes and the arm64 zip fell 119061. Dev still loads app-icon.png from src/main/assets. Do not remove the png from the repo or from win/linux extraResources.","package_delta":124526,"zip_delta":119061}}
{"run":17,"commit":"fd2fe08","metric":2360604223000,"metrics":{"package_bytes":236060427,"zip_bytes":100227427,"locale_bytes":569838,"asar_bytes":6120349,"renderer_js_bytes":3750752,"main_js_bytes":1910835,"stockfish_bytes":0,"marketing_bytes":1363209,"lh_perf":0,"lh_a11y":95,"lh_bp":0,"lh_seo":82,"lh_pages":6,"knip_issues":0,"unreferenced_images":0},"status":"keep","description":"Encode piece-theme SVGs as CSS data URLs instead of base64. Same drawings, 16,694 fewer bytes in the package.","timestamp":1791595006716,"segment":0,"confidence":1185637.4801607232,"asi":{"hypothesis":"Percent-encoded SVG data URLs are smaller than base64 and still render the same piece sets","learned":"asar and package both fell by exactly 16694 bytes. Zip fell 22593. All 8 piece sets stay. Do not switch back to base64.","package_delta":16694,"asar_delta":16694,"zip_delta":22593}}
{"run":18,"commit":"ed6a253","metric":2358647223000,"metrics":{"package_bytes":235864774,"zip_bytes":100230385,"locale_bytes":569838,"asar_bytes":5924696,"renderer_js_bytes":3750752,"main_js_bytes":1715182,"stockfish_bytes":0,"marketing_bytes":1363209,"lh_perf":0,"lh_a11y":95,"lh_bp":0,"lh_seo":82,"lh_pages":6,"knip_issues":0,"unreferenced_images":0},"status":"keep","description":"Gzip the bundled opening book. The main process inflates it on first read; the named openings are unchanged.","timestamp":1791624483306,"segment":0,"confidence":3782.9414843259806,"asi":{"hypothesis":"Gzipping the opening-book text shrinks the main bundle without changing which openings resolve","learned":"Unpacked app and main JS both fell 195653 bytes. The arm64 zip rose 2958 bytes because the payload is already compressed. Not catastrophic. Do not gzip more already-small text; it can grow the download.","package_delta":195653,"zip_delta":-2958,"main_js_delta":195653}}
{"run":19,"commit":"ed6a253","metric":2350513223000,"metrics":{"package_bytes":235051383,"zip_bytes":100063364,"locale_bytes":569838,"asar_bytes":5111305,"renderer_js_bytes":2937361,"main_js_bytes":1715182,"stockfish_bytes":0,"marketing_bytes":1363209,"lh_perf":0,"lh_a11y":95,"lh_bp":0,"lh_seo":82,"lh_pages":6,"knip_issues":0,"unreferenced_images":0},"status":"checks_failed","description":"Replacing the puzzle rating chart's Recharts dependency cut 813KB, but the sparkline's hover handler sat on a role=img element and lint failed.","timestamp":1791624880051,"segment":0,"confidence":1894.4955758004335,"asi":{"hypothesis":"A small SVG sparkline can replace Recharts for the puzzle rating line and drop the library from the package","rollback_reason":"jsx-a11y no-noninteractive-element-interactions: onMouseLeave on role=img","next_action_hint":"Keep the SVG sparkline and the recharts removal. Put hover handlers on a plain wrapper, not the role=img element. The 813KB cut was real.","revisits_run":18,"package_delta":813391,"zip_delta":167021}}
{"run":20,"commit":"ccdc1f6","metric":2350513223000,"metrics":{"package_bytes":235051321,"zip_bytes":100063271,"locale_bytes":569838,"asar_bytes":5111243,"renderer_js_bytes":2937299,"main_js_bytes":1715182,"stockfish_bytes":0,"marketing_bytes":1363209,"lh_perf":0,"lh_a11y":95,"lh_bp":0,"lh_seo":82,"lh_pages":6,"knip_issues":0,"unreferenced_images":0},"status":"keep","description":"Replace the puzzle rating sparkline's Recharts chart with a small SVG. Hover still shows the rating and date.","timestamp":1791625020867,"segment":0,"confidence":1769.2985428589684,"asi":{"hypothesis":"Recharts is only used for a 44px puzzle-rating line, so an SVG sparkline can drop the library","learned":"Unpacked app fell 813453 bytes and the arm64 zip fell 167114. Hover stays on a plain wrapper so role=img has no mouse handler. Do not bring recharts back for this chart.","revisits_run":19,"package_delta":813453,"zip_delta":167114}}
{"run":21,"commit":"08df8f9","metric":2325197223000,"metrics":{"package_bytes":232519707,"zip_bytes":99614657,"locale_bytes":569838,"asar_bytes":2579629,"renderer_js_bytes":1308800,"main_js_bytes":850444,"stockfish_bytes":0,"marketing_bytes":1363209,"lh_perf":0,"lh_a11y":95,"lh_bp":0,"lh_seo":82,"lh_pages":6,"knip_issues":0,"unreferenced_images":0},"status":"keep","description":"Minify the packaged main, preload, and renderer. electron-vite leaves minify off, so the asar was shipping readable bundles.","timestamp":1791625293413,"segment":0,"confidence":1646.7402417516005,"asi":{"hypothesis":"electron-vite defaults minify to false, so enabling it shrinks the asar without changing behavior","learned":"Unpacked app fell 2531614 bytes, asar fell from 5.11MB to 2.58MB, arm64 zip fell 448614. Lighthouse pages still load. Do not turn minify back off.","package_delta":2531614,"asar_delta":2531614,"zip_delta":448614}}
{"run":22,"commit":"61ab2c8","metric":2323054223000,"metrics":{"package_bytes":232305477,"zip_bytes":99423401,"locale_bytes":569838,"asar_bytes":2579629,"renderer_js_bytes":1308800,"main_js_bytes":850444,"stockfish_bytes":0,"marketing_bytes":1363209,"lh_perf":0,"lh_a11y":95,"lh_bp":0,"lh_seo":82,"lh_pages":6,"knip_issues":0,"unreferenced_images":0},"status":"keep","description":"Recompress the app icon. The artwork is already grayscale, so the icns PNGs shrink without a visible change.","timestamp":1791625501232,"segment":0,"confidence":971.7859119490095,"asi":{"hypothesis":"The icns PNG layers are stored as RGBA even though the icon is grayscale, so a lossless recompress shrinks the dock icon","learned":"Unpacked app fell exactly 214230 bytes and the arm64 zip fell 191256. oxipng grayscale+alpha is lossless for this artwork. Do not drop the 1024px layer; that would blur the dock icon.","package_delta":214230,"zip_delta":191256}}
